{"schema_version":"1.0","chunk_id":"ae13-chunk-0900","revision_id":"ae13-chunk-rev-001","prior_revision_id":null,"supersedes_revision_id":null,"window":{"start":"2026-07-13T09:00:00Z","end":"2026-07-13T09:05:00Z"},"generated_at":"2026-07-13T09:05:30Z","display_timezone":"Europe/Zurich","aggregator_version":"synthetic-ae13","input_digest":"sha256-ae13-ten-unchanged","store_generation":1,"finalization_cadence_seconds":30,"evidence_seconds":{"captured":300,"protected":0,"paused":0,"unavailable":0,"error":0,"gap":0},"presence_seconds":{"active":300,"idle":0,"unknown":0},"duration_estimates":[{"dimension":"application","key":"com.example.writer","label":"Synthetic Writer","estimated_seconds":300,"supporting_event_ids":["ae13-evt-01","ae13-evt-02","ae13-evt-03","ae13-evt-04","ae13-evt-05","ae13-evt-06","ae13-evt-07","ae13-evt-08","ae13-evt-09","ae13-evt-10"]}],"transitions":[],"ocr_extracts":[],"gaps":[],"supporting_event_ids":["ae13-evt-01","ae13-evt-02","ae13-evt-03","ae13-evt-04","ae13-evt-05","ae13-evt-06","ae13-evt-07","ae13-evt-08","ae13-evt-09","ae13-evt-10"],"late_input":false}
